{
  "subject": {
    "program": "TRDPB001",
    "stream": "SETLUSD"
  },
  "legs": {
    "expected_semantic": {
      "records": [
        {
          "status": "601",
          "currency": "USD",
          "amount": "123.45",
          "trade_date": "2024-01-01"
        }
      ],
      "provenance": {
        "kind": "semantic_model",
        "source": "FR-SETL-008"
      }
    },
    "legacy_execution": {
      "records": [
        {
          "currency": "USD",
          "amount": "123.45",
          "status": "601",
          "trade_date": "2024-01-01"
        }
      ],
      "provenance": {
        "kind": "supplied",
        "source": "One-line supplied fixture; no z/OS execution is shipped."
      }
    },
    "target_execution": {
      "records": [
        {
          "currency": "USD",
          "amount": "123.45",
          "status": "601",
          "trade_date": "2024-01-01"
        }
      ],
      "provenance": {
        "kind": "local_h2",
        "source": "portable Db2 fixture"
      }
    }
  },
  "normalization_rules_applied": [
    "packed COMP-3 5-byte amount to BigDecimal",
    "trim EBCDIC/CHAR padding",
    "YYYYMMDD to ISO date"
  ],
  "comparisons": [
    {
      "field": "amount",
      "values": {
        "expected_semantic": "123.45",
        "legacy_execution": "123.45",
        "target_execution": "123.45"
      },
      "verdict": "pass",
      "tolerance": "exact"
    },
    {
      "field": "currency",
      "values": {
        "expected_semantic": "USD",
        "legacy_execution": "USD",
        "target_execution": "USD"
      },
      "verdict": "pass",
      "tolerance": "exact"
    },
    {
      "field": "status",
      "values": {
        "expected_semantic": "601",
        "legacy_execution": "601",
        "target_execution": "601"
      },
      "verdict": "pass",
      "tolerance": "exact"
    },
    {
      "field": "trade_date",
      "values": {
        "expected_semantic": "2024-01-01",
        "legacy_execution": "2024-01-01",
        "target_execution": "2024-01-01"
      },
      "verdict": "pass",
      "tolerance": "exact"
    }
  ],
  "control_totals": {
    "expected": "n/a",
    "legacy": "n/a",
    "target": "n/a"
  },
  "record_counts": {
    "expected": 1,
    "legacy": 1,
    "target": 1
  },
  "verdict": "pass",
  "run_metadata": {
    "run_id": "reference-settlement-001",
    "timestamp": "2026-08-10T19:55:11.293180+00:00",
    "environment": "portable H2 / supplied legacy fixture"
  },
  "fr_ids": [
    "FR-SETL-008"
  ]
}
